{
  "id": "S24",
  "title": "Karnataka Dy CM Shivakumar announces Rs 5 crore for Cubbon Park development",
  "publisher": "ANI",
  "doc_type": "news",
  "url": "https://aninews.in/news/national/general-news/karnataka-dy-cm-shivakumar-announces-rs-5-crore-for-cubbon-park-development20251026205845/",
  "published_on": "2025-10-26",
  "retrieved_on": "2026-09-20",
  "archive_url": null
}
