{
  "id": "S34",
  "title": "BMRCL awarding 14-km metro contracts to ITD & Afcons (Pink Line underground packages)",
  "publisher": "NBM&CW",
  "doc_type": "news",
  "url": "https://www.nbmcw.com/news/bmrcl-awarding-14-km-metro-contracts-to-itd-afcons.html",
  "retrieved_on": "2026-09-20",
  "archive_url": null
}
