{
  "id": "S17",
  "title": "Bengaluru Suburban Rail: Route Map & Status Updates",
  "publisher": "The Metro Rail Guy",
  "doc_type": "news",
  "url": "https://themetrorailguy.com/kride-bengaluru-suburban-rail-project-route-map-fares-tenders-status-updates/",
  "published_on": "2025-06-30",
  "retrieved_on": "2026-09-19",
  "archive_url": null
}
