{
  "id": "S30",
  "title": "Bangalore Development Authority vs State Of Karnataka — Supreme Court of India order, 26 October 2021 (hosted on Indian Kanoon)",
  "publisher": "Supreme Court of India (via Indian Kanoon)",
  "doc_type": "agency_report",
  "url": "https://indiankanoon.org/doc/81213864/",
  "published_on": "2021-10-26",
  "retrieved_on": "2026-09-20",
  "archive_url": null
}
