{
  "id": "S32",
  "title": "Bangalore Metro Terminates Simplex Infra's Pink Line Contract",
  "publisher": "The Metro Rail Guy",
  "doc_type": "news",
  "url": "https://themetrorailguy.com/2021/02/04/bangalore-metro-terminates-simplex-infras-pink-line-contract/",
  "published_on": "2021-02-04",
  "retrieved_on": "2026-09-20",
  "archive_url": null
}
