{
  "id": "S39",
  "title": "Bangalore Metro Rail Awards J Kumar-AICPL JV With Rs. 182 Crore Contract For Blue Line's Airport Depot",
  "publisher": "Metro Rail News",
  "doc_type": "news",
  "url": "https://metrorailnews.in/bangalore-metro-rail-awards-j-kumar-aicpl-jv-with-rs-182-crore-contract-for-blue-lines-airport-depot/",
  "retrieved_on": "2026-09-20",
  "archive_url": null
}
