{
  "id": "S36",
  "title": "BMRCL hopes to wrap up Baiyappanahalli-Whitefield metro line work in time",
  "publisher": "Deccan Herald",
  "doc_type": "news",
  "url": "https://www.deccanherald.com/content/655205/bmrcl-hopes-wrap-up-baiyappanahalli.html",
  "retrieved_on": "2026-09-20",
  "archive_url": null
}
