{
  "id": "S1",
  "title": "Karnataka cabinet okays Rs 9,729.90 crore cost hike for Namma Metro's Phase 2",
  "publisher": "Deccan Herald",
  "doc_type": "news",
  "url": "https://www.deccanherald.com/india/karnataka/bengaluru/karnataka-cabinet-okays-rs-972990-crore-cost-hike-for-namma-metros-phase-2-3553615",
  "retrieved_on": "2026-09-19",
  "archive_url": null
}
