{
  "id": "S13",
  "title": "BWSSB anticipated a flood, but there is only a trickle",
  "publisher": "Deccan Herald",
  "doc_type": "news",
  "url": "https://www.deccanherald.com/india/karnataka/bengaluru/bwssb-anticipated-a-flood-but-there-is-only-a-trickle-3940199",
  "published_on": "2026-03-21",
  "retrieved_on": "2026-09-19",
  "archive_url": null
}
