{
  "id": "S37",
  "title": "Bangalore Metro: Green Line's Nagasandra-Madavara Stretch Becomes Operational",
  "publisher": "Metro Rail News",
  "doc_type": "news",
  "url": "https://metrorailnews.in/bangalore-metros-green-line-extension-opens/",
  "published_on": "2024-11-07",
  "retrieved_on": "2026-09-20",
  "archive_url": null
}
