{
  "id": "S20",
  "title": "As Namma Metro turns five, here are five things to know about it",
  "publisher": "The News Minute",
  "doc_type": "news",
  "url": "https://www.thenewsminute.com/karnataka/namma-metro-turns-five-here-are-five-things-know-about-it-51686",
  "published_on": "2016-10-20",
  "retrieved_on": "2026-09-19",
  "archive_url": null
}
