{
  "id": "S38",
  "title": "Afcons & Shankaranarayana Awarded Bangalore Metro Phase 2A Work",
  "publisher": "The Metro Rail Guy",
  "doc_type": "news",
  "url": "https://themetrorailguy.com/2021/05/25/afcons-shankaranarayana-awarded-bangalore-metro-phase-2a-work/",
  "published_on": "2021-05-25",
  "retrieved_on": "2026-09-20",
  "archive_url": null
}
