{
  "id": "S35",
  "title": "BMRCL MD inspected Mysuru Road-Kengeri Section of Bangalore Metro",
  "publisher": "Metro Rail News",
  "doc_type": "news",
  "url": "https://www.metrorailnews.in/bmrcl-md-inspected-mysuru-road-kengeri-section-of-bangalore-metro/",
  "retrieved_on": "2026-09-20",
  "archive_url": null
}
