{
  "id": "S22",
  "title": "Bengaluru tunnel road Hebbal-Silk Board: Adani lowest at Rs 22,267 cr, buyer impact analysis",
  "publisher": "PropNewz",
  "doc_type": "news",
  "url": "https://www.propnewz.com/blog/bengaluru-tunnel-road-hebbal-silk-board-adani-22267-cr-bid-buyer-impact-2026-05-23",
  "published_on": "2026-08-26",
  "retrieved_on": "2026-09-20",
  "archive_url": null
}
