{
  "id": "S23",
  "title": "Hebbal, Nagawara Lake Projects Reclaim 21 Acres Of Encroached Land For Wetlands And Walking Tracks",
  "publisher": "Oneindia",
  "doc_type": "news",
  "url": "https://www.oneindia.com/bengaluru/hebbal-nagawara-lake-projects-reclaim-21-acres-of-encroached-land-for-wetlands-and-walking-tracks-8089311.html",
  "published_on": "2026-05-15",
  "retrieved_on": "2026-09-20",
  "archive_url": null
}
