{
  "id": "S19",
  "title": "KfW Bank signs €500 million loan deal with K-RIDE for Bengaluru Suburban Rail Project",
  "publisher": "Urban Transport News",
  "doc_type": "news",
  "url": "https://urbantransportnews.com/news/kfw-bank-signs-500-million-loan-deal-with-k-ride-for-bengaluru-suburban-rail-project",
  "published_on": "2023-12-15",
  "retrieved_on": "2026-09-19",
  "archive_url": null
}
