{
  "id": "S8",
  "title": "Bengaluru Metro Pink Line stretch likely to open this month",
  "publisher": "Newskarnataka",
  "doc_type": "news",
  "url": "https://newskarnataka.com/bengaluru/bengaluru-metro-pink-line-stretch-likely-to-open-this-month/03092026/",
  "published_on": "2026-09-03",
  "retrieved_on": "2026-09-19",
  "archive_url": null
}
