{
  "id": "S10",
  "title": "Bids Invited for Bangalore Metro Phase 3's Construction Work",
  "publisher": "The Metro Rail Guy",
  "doc_type": "news",
  "url": "https://themetrorailguy.com/2026/01/14/bids-invited-for-bangalore-metro-phase-3s-construction-work/",
  "published_on": "2026-01-14",
  "retrieved_on": "2026-09-19",
  "archive_url": null
}
