{
  "id": "S9",
  "title": "Cabinet approves Phase-3 of 44.65 km Namma metro rail with 31 stations",
  "publisher": "Construction World",
  "doc_type": "news",
  "url": "https://www.constructionworld.in/transport-infrastructure/metro-rail-and-railways-infrastructure/cabinet-approves-phase-3-of-44.65-km-namma-metro-rail-with-31-stations/60924",
  "published_on": "2024-08-16",
  "retrieved_on": "2026-09-19",
  "archive_url": null
}
