{
  "id": "S33",
  "title": "GR Infra Wins Bangalore Metro Pink Line's Pending Work",
  "publisher": "The Metro Rail Guy",
  "doc_type": "news",
  "url": "https://themetrorailguy.com/2021/07/16/gr-infra-wins-bangalore-metro-pink-lines-pending-work/",
  "published_on": "2021-07-16",
  "retrieved_on": "2026-09-20",
  "archive_url": null
}
