{
  "id": "S27",
  "title": "Namma Metro: BEML to supply 7 more trains for Pink Line for Rs 405 cr",
  "publisher": "Deccan Herald",
  "doc_type": "news",
  "url": "https://www.deccanherald.com/amp/story/india%2Fkarnataka%2Fbengaluru%2Fnamma-metro-beml-to-supply-7-more-trains-for-pink-line-for-rs-405-cr-2-3466975",
  "retrieved_on": "2026-09-20",
  "archive_url": null
}
