{
  "id": "S11",
  "title": "Namma Metro Expansion: BMRCL Proposes 73-km Route to Connect IT Hubs and Ease Traffic Congestion",
  "publisher": "Asianet Newsable",
  "doc_type": "news",
  "url": "https://newsable.asianetnews.com/karnataka-news/namma-metro-expansion-bmrcl-proposes-73-km-route-to-connect-it-hubs-ease-traffic-congestion-articleshow-spzthqw",
  "published_on": "2026-05-09",
  "retrieved_on": "2026-09-19",
  "archive_url": null
}
