{
  "id": "S15",
  "title": "Bengaluru Business Corridor Package 1 Nears Award: What Buyers Near the Ring Should Know (updated 2026-08-26)",
  "publisher": "PropNewz",
  "doc_type": "news",
  "url": "https://www.propnewz.com/blog/bengaluru-business-corridor-prr-package-1-loa-buyer-2026-06-07",
  "published_on": "2026-08-26",
  "retrieved_on": "2026-09-19",
  "archive_url": null
}
