{
  "id": "S25",
  "title": "GBA Budget 2026: How Bengaluru's East and Central corporations plan to reshape the city",
  "publisher": "The News Minute",
  "doc_type": "news",
  "url": "https://www.thenewsminute.com/karnataka/gba-budget-2026-how-bengalurus-east-and-central-corporations-plan-to-reshape-the-city",
  "published_on": "2026-03-27",
  "retrieved_on": "2026-09-20",
  "archive_url": null
}
